{
  "stage": "frontend_release_gate",
  "run_id": "phase1_2_complete_20260706_194129",
  "decision": "GO",
  "generated_at": "2026-07-06T19:41:29Z",
  "severity_counts": {
    "P0": 0,
    "P1": 0,
    "P2": 0,
    "P3": 0
  },
  "category_scores": {
    "ux": 90,
    "accessibility": 88,
    "responsive": 88,
    "performance": 90
  },
  "findings": []
}
