{
  "stage": "frontend_release_gate",
  "run_id": "hardening_release_20260630_050531",
  "decision": "GO WITH RISKS",
  "generated_at": "2026-06-30T05:06:43+00:00",
  "severity_counts": {
    "P0": 0,
    "P1": 0,
    "P2": 4,
    "P3": 0
  },
  "category_scores": {
    "frontend_release_gate": 80
  },
  "findings": [
    {
      "id": "F-027",
      "severity": "P2",
      "category": "F3",
      "description": "Typing indicator unthrottled",
      "status": "Pending",
      "release_impact": "Low"
    },
    {
      "id": "F-028",
      "severity": "P2",
      "category": "F3",
      "description": "No sending indicator on optimistic messages",
      "status": "Pending",
      "release_impact": "Low"
    },
    {
      "id": "F-029",
      "severity": "P2",
      "category": "F6",
      "description": "Missing tablet breakpoint in chat layout",
      "status": "Pending",
      "release_impact": "Medium"
    },
    {
      "id": "F-030",
      "severity": "P2",
      "category": "F7",
      "description": "Notification dropdown overflow",
      "status": "Pending",
      "release_impact": "Low"
    }
  ]
}
