{
  "stage": "quality_confirmation",
  "run_id": "hardening_release_20260630_050531",
  "decision": "GO",
  "generated_at": "2026-06-30T05:06:43+00:00",
  "severity_counts": {
    "P0": 0,
    "P1": 0,
    "P2": 1,
    "P3": 0
  },
  "category_scores": {
    "quality_confirmation": 95
  },
  "findings": [
    {
      "id": "F-023",
      "severity": "P2",
      "category": "K",
      "description": "Missing tablet breakpoint in UI",
      "status": "Pending",
      "release_impact": "Medium"
    }
  ]
}
