{
  "stage": "principal_audit",
  "run_id": "phase1_2_complete_20260706_194129",
  "decision": "GO",
  "generated_at": "2026-07-06T19:41:29Z",
  "severity_counts": {
    "P0": 0,
    "P1": 0,
    "P2": 0,
    "P3": 0
  },
  "category_scores": {
    "message_list_decomposition": 95,
    "emoji_picker": 95,
    "keyboard_shortcuts": 92,
    "i18n_scaffolding": 85,
    "search_improvements": 90,
    "file_preview": 90,
    "channel_context_menu": 90,
    "sidebar_categories": 88
  },
  "findings": []
}
