{
  "stage": "reconciliation",
  "run_id": "hardening_release_20260630_050531",
  "decision": "GO",
  "generated_at": "2026-06-30T05:06:43+00:00",
  "severity_counts": {
    "P0": 0,
    "P1": 0,
    "P2": 1,
    "P3": 0
  },
  "category_scores": {
    "reconciliation": 95
  },
  "findings": [
    {
      "id": "F-008",
      "severity": "P2",
      "category": "N",
      "description": "Migration rollback scripts missing",
      "status": "Pending",
      "release_impact": "Low"
    }
  ]
}
