{
  "stage": "reconciliation",
  "run_id": "current_state_check_20260706_180950",
  "decision": "GO",
  "generated_at": "2026-07-06T18:09:50Z",
  "severity_counts": {
    "P0": 0,
    "P1": 0,
    "P2": 0,
    "P3": 0
  },
  "category_scores": {
    "security": 95,
    "api_integrity": 92,
    "database": 90,
    "frontend": 88,
    "infrastructure": 85,
    "testing": 70,
    "observability": 80,
    "ci_cd": 85,
    "hardening": 90,
    "ux_ui": 90
  },
  "findings": []
}