{
  "stage": "quality_confirmation",
  "run_id": "testrun_001",
  "decision": "NO-GO",
  "generated_at": "2026-06-22T07:23:08+00:00",
  "severity_counts": {
    "P0": 1,
    "P1": 1,
    "P2": 0,
    "P3": 0
  },
  "category_scores": {
    "quality_confirmation": 50
  },
  "findings": [
    {
      "id": "F-005",
      "severity": "P0",
      "category": "Category J",
      "description": "Mobile responsive failure",
      "status": "Unresolved",
      "release_impact": "Blocking"
    },
    {
      "id": "F-006",
      "severity": "P1",
      "category": "Category H",
      "description": "Visual inconsistency",
      "status": "Partially Fixed",
      "release_impact": "High"
    }
  ]
}
