{
  "stage": "reconciliation",
  "run_id": "phase1_2_complete_20260706_194129",
  "decision": "GO",
  "generated_at": "2026-07-06T19:41:29Z",
  "severity_counts": {
    "P0": 0,
    "P1": 0,
    "P2": 0,
    "P3": 0
  },
  "category_scores": {
    "architecture": 95,
    "feature_completeness": 88,
    "code_quality": 92,
    "ui_ux": 90,
    "testing": 80,
    "docs": 85
  },
  "findings": []
}