{
  "stage": "frontend_release_gate",
  "run_id": "testrun_001",
  "decision": "GO WITH RISKS",
  "generated_at": "2026-06-22T07:23:09+00:00",
  "severity_counts": {
    "P0": 0,
    "P1": 1,
    "P2": 1,
    "P3": 0
  },
  "category_scores": {
    "frontend_release_gate": 80
  },
  "findings": [
    {
      "id": "F-007",
      "severity": "P1",
      "category": "F5 Accessibility",
      "description": "Missing focus states",
      "status": "Partially Fixed",
      "release_impact": "High"
    },
    {
      "id": "F-008",
      "severity": "P2",
      "category": "F9 Visual Consistency",
      "description": "Minor spacing drift",
      "status": "Fixed",
      "release_impact": "Medium"
    }
  ]
}
