{
  "stage": "quality_confirmation",
  "run_id": "testrun_001",
  "decision": "NO-GO",
  "generated_at": "2026-06-22T07:05:20+00:00",
  "severity_counts": {
    "P0": 1,
    "P1": 1,
    "P2": 0,
    "P3": 0
  },
  "category_scores": {
    "A Monorepo Workspace Package Governance": 50,
    "B TypeScript Build Import Integrity": 50,
    "C Frontend Backend Database Contract Alignment": 50,
    "D Authentication Authorization Security Surface": 50,
    "E Environment Domain Consistency": 50,
    "F API Realtime Socket Correctness": 50,
    "G Frontend Routing UX State Provider Integrity": 50,
    "H UXUI Design Quality": 50,
    "I Accessibility Readiness": 50,
    "J Responsive Readiness": 50,
    "K Quality Tooling Test Validation Infrastructure": 50,
    "L CICD GitHub Environments Release Automation": 50,
    "M Docker Traefik Runtime Orchestration": 50,
    "N Terraform Cloud-Init Host Provisioning": 50,
    "O Documentation Runbooks Contributor Guidance": 50,
    "P Dead Files Duplicate Systems Stale Artifacts": 50
  },
  "findings": [
    {
      "id": "F-005",
      "severity": "P0",
      "category": "Category J",
      "description": "Mobile responsive failure",
      "status": "Unresolved",
      "release_impact": "Blocking"
    },
    {
      "id": "F-006",
      "severity": "P1",
      "category": "Category H",
      "description": "Visual inconsistency",
      "status": "Partially Fixed",
      "release_impact": "High"
    }
  ],
  "notes": "Parsed from markdown report."
}
